{
  "$schema": "https://json-schema.org/draft/2020-12/schema",
  "type": "object",
  "required": [
    "summary"
  ],
  "additionalProperties": false,
  "properties": {
    "summary": {
      "type": "string",
      "minLength": 1
    },
    "resolutions": {
      "type": "array",
      "items": {
        "type": "object",
        "required": [
          "finding_id",
          "status",
          "explanation"
        ],
        "additionalProperties": false,
        "properties": {
          "finding_id": {
            "type": "string",
            "minLength": 1
          },
          "status": {
            "enum": [
              "addressed",
              "needs_decision"
            ]
          },
          "explanation": {
            "type": "string",
            "minLength": 1
          }
        }
      },
      "minItems": 0
    },
    "teaching_notes": {
      "type": "array",
      "items": {
        "type": "string",
        "minLength": 1
      },
      "minItems": 0
    },
    "open_questions": {
      "type": "array",
      "items": {
        "type": "string",
        "minLength": 1
      },
      "minItems": 0
    },
    "feedback_checks": {
      "type": "array",
      "items": {
        "type": "object",
        "required": [
          "id",
          "version",
          "status",
          "explanation",
          "evidence"
        ],
        "additionalProperties": false,
        "properties": {
          "id": {
            "type": "string",
            "minLength": 1
          },
          "version": {
            "type": "integer",
            "minimum": 1
          },
          "status": {
            "enum": [
              "satisfied",
              "issue",
              "not_applicable"
            ]
          },
          "explanation": {
            "type": "string",
            "minLength": 1
          },
          "evidence": {
            "type": "array",
            "items": {
              "type": "object",
              "required": [
                "slide_id",
                "quote"
              ],
              "additionalProperties": false,
              "properties": {
                "slide_id": {
                  "type": "string",
                  "minLength": 1
                },
                "quote": {
                  "type": "string",
                  "minLength": 1
                }
              }
            }
          }
        }
      }
    },
    "repair_checks": {
      "type": "array",
      "items": {
        "type": "object",
        "required": [
          "problem_id",
          "status",
          "explanation",
          "slide_ids"
        ],
        "additionalProperties": false,
        "properties": {
          "problem_id": {
            "type": "string",
            "minLength": 1
          },
          "status": {
            "enum": [
              "addressed",
              "not_found",
              "needs_decision"
            ]
          },
          "explanation": {
            "type": "string",
            "minLength": 1
          },
          "slide_ids": {
            "type": "array",
            "items": {
              "type": "string",
              "minLength": 1
            },
            "uniqueItems": true
          }
        }
      }
    },
    "slide_changes": {
      "type": "array",
      "items": {
        "type": "object",
        "additionalProperties": false,
        "required": [
          "slide_id",
          "action",
          "target_slide_id",
          "reason"
        ],
        "properties": {
          "slide_id": {
            "type": "string",
            "minLength": 1
          },
          "action": {
            "enum": [
              "delete",
              "merge"
            ]
          },
          "target_slide_id": {
            "type": [
              "string",
              "null"
            ],
            "minLength": 1
          },
          "reason": {
            "type": "string",
            "minLength": 1
          }
        }
      }
    }
  }
}
